ubicacion,fecha,puntuacion,titulo_comentario,comentario_negativo,comentario_positivo,etiquetas
MadridPalacioReal,19-02-2023,"8,0",Gonzalo,el ruido de noche era muy intenso,,Viaje de ocio | Pareja | Estudio | Estancia de 4 noches | Enviado por móvil
MadridPalacioReal,05-02-2023,"8,0",Juan,escalones para llegar a elevador,localização,Viaje de negocios | Pareja | Estudio | Estancia de 2 noches | Enviado por móvil
MadridPalacioReal,24-01-2023,"8,0",María,"MUY ruidoso, se escucha durante toda la madrugada el trasiego de personas y coches en la calle, una pena.","Ubicación ideal, habitación amplia y camas cómodas.",Viaje de ocio | Pareja | Estudio | Estancia de 3 noches | Enviado por móvil
MadridPalacioReal,02-01-2023,"9,0",Roberto,"Creo que faltó un pequeño kit para cocinar, como aceite y sal, ya que comprar un litro de aceite y un paquete de sal es excesivo para un fin de semana",,Viaje de ocio | Pareja | Estudio | Estancia de 2 noches | Enviado por móvil
MadridPalacioReal,15-12-2025,10,Leticia,,"En pleno centro de Madrid , limpísimo. Decoración exquisita , con dos balcones a la Plaza de San Martin con mucha luz natural . Perfecto",Viaje de ocio | Grupo | Estudio Dúplex | Estancia de 1 noche | Enviado por móvil
MadridPalacioReal,08-12-2025,10,Isabel,"El precio, pero normal para Madrid en el puente de las inmaculada.","Un 10 en ubicacion limpieza, instalaciones",Viaje de ocio | Pareja | Estudio | Estancia de 2 noches | Enviado por móvil
MadridPalacioReal,28-03-2024,10,Ignacio,Había un papel de chocolatina en el suelo,El espacio y la habitación y el detalle al llegar y el kit de limpieza en la cocina,Viaje de ocio | Familia con niños pequeños | Estudio Deluxe | Estancia de 1 noche | Enviado por móvil
MadridPalacioReal,19-03-2024,"6,0",Amaia,El olor del cuarto de baño.,"Nos tocó ell último piso, el apartamento bien. La única pega el cuarto de baño, no tenía ventilación y olía a tuberías.",Viaje de ocio | Pareja | Estudio | Estancia de 2 noches
MadridPalacioReal,09-03-2024,10,Cristina,El colchón del sofá cama era mejorable. Por la noche se escucha el ruido de la gente que sale del pub de abajo y se quedan en la calle.,Nos encantó el espacio abierto que tenía el apartamento. Estaba todo muy limpio. Dejaron detallitos para nosotros y nuestra perrita.,Viaje de ocio | Familia con niños pequeños | Estudio Dúplex | Estancia de 2 noches | Enviado por móvil
MadridPalacioReal,19-02-2024,"5,0",Marta,"Mucho ruido de la calle, las ventanas no cierran bien, pasa el frío y se escuchan las conversaciones . hace frío la. Calefacción es por split nunca llega a calentarse .",Localización,Viaje de ocio | Familia con niños pequeños | Estudio Deluxe | Estancia de 2 noches | Enviado por móvil
MadridPalacioReal,15-02-2024,10,Anna,"El baño, creo que para lo bonita que es la habitación el baño habría que valorarlo de alguna manera","Mucho, nos encanto. Posición súper ideal, muy acogedor.",Viaje de ocio | Pareja | Estudio | Estancia de 1 noche | Enviado por móvil
MadridPalacioReal,24-01-2024,"5,0",Isabel,Poca limpieza. Ruido fuerte,Ubicacion,Familia con niños pequeños | Estudio | Estancia de 1 noche | Enviado por móvil
MadridPalacioReal,22-01-2024,10,Glenda,,"La habitación con todo lo necesario y limpio. Además con una mini terraza, muy agradable",Viaje de ocio | Familia con niños pequeños | Estudio | Estancia de 2 noches | Enviado por móvil
MadridPalacioReal,12-01-2024,"6,0",Enrique,,"Limpiar las habitaciones diario, y cambiar las toallas diario",Viaje de ocio | Persona que viaja sola | Estudio | Estancia de 2 noches | Enviado por móvil
MadridPalacioReal,03-01-2024,"1,0",Jfr2011,"Por lo bonito q parece, Evita este alojamiento para ahorrarte tu dinero y estres. Primero, han publicado fotos que no era el que hemos reservado, y al avisarles q hemos reservado un suite con la mejor distribucion (que costaba mas), han cambiado las fotos publicados con la explicacion de las fotos no suelen reflejar los suites exactamente. Encima, nos dijo que el que estuvimos era ya un upgrade, mejor que la original..y claramente no era ni lo que eligio basado en las fotos.
Pues si era el suite mejor pq tenia el televisor roto? Al avisar tampoco lo arreglaron. Ademas, la calefacción no funciona, paredes finos, luces antiguos, mantas/almohadas sucias, decoración de calidad básica como de un estudiante..
Comunicación del personal es escaso e impersonal- por teléfono era una mujer muy borde y un hombre inutil. Mejor comunicar con los agente online, pero como dicho antes, Dan escusas y no hacen un seguimiento de las problemas del suite que he comunicado.
He alquilando varias veces los SMART checkins y funciona muy bien, pero en este caso parece una excusa para ser vago en el tratamiento de los huespedes.
Casi 700€ para 4 noches (ya descontado por ser Genius 3 en Booking), he podido haber gastado en un sitio mejor para asegurar que la visita de mis padres sea al minimo funcional...","La ubicación, la idea de self check in",Viaje de ocio | Familia con niños pequeños | Estudio Dúplex | Estancia de 4 noches | Enviado por móvil
MadridPalacioReal,25-12-2023,"6,0",David,"CAMAS, INCOMODAS Y PEQUEÑAS",LIMPIEZA,Viaje de ocio | Familia con niños pequeños | Estudio Dúplex | Estancia de 2 noches
MadridPalacioReal,05-12-2023,10,Guillermo,"No tengo quejas del establecimiento. Como en cualquier alojamiento, depende del azar que coincidas con clientes poco educados y ruidosos.","El alojamiento es exactamente lo que publicita en todos los aspectos. Céntrico, funcional y con atención por parte del personal tanto telefónico como presencial verdaderamente exquisita.",Con una mascota | Viaje de ocio | Familia con niños pequeños | Estudio | Estancia de 8 noches
MadridPalacioReal,30-11-2023,10,Miguel,Es muy impersonal. No dan ningún amenities como complemento a sus huespedes.,The location and the privacy,Viaje de ocio | Persona que viaja sola | Estudio Deluxe | Estancia de 6 noches | Enviado por móvil
MadridPalacioReal,16-11-2023,10,Luis,,"Muy cómodo, buena relación calidad precio",Viaje de ocio | Familia con niños pequeños | Estudio | Estancia de 1 noche | Enviado por móvil
MadridPalacioReal,09-11-2023,"5,0",Luis,"Ruido durante toda la noche, nula insonorización de las ventanas que dan a la calle hace que dormir sea imposible, escuchas todas las platicas de las personas que circundan la plaza colindante. Es una lástima porque el departamento esta muy bien equipado, pero con niños pequeños es complicado lograr que duerman bien.","La ubicación definitivamente es muy buena en cuanto a los restaurantes, puntos de interés y compras. Todo a minutos caminando.",Con una mascota | Viaje de ocio | Familia con niños pequeños | Estudio Dúplex | Estancia de 1 noche
MadridPalacioReal,19-10-2023,10,Mª,"Lo que menos el precio, sobre todo si usas muy escasamente el servicio de cocina.","La luz, la limpieza, la distribución, la atención...",Viaje de ocio | Familia con niños pequeños | Estudio | Estancia de 3 noches | Enviado por móvil
MadridPalacioReal,14-10-2023,10,Hugo,,Muy bonito muy cómodo volvería a repetir,Viaje de ocio | Familia con niños pequeños | Estudio | Estancia de 2 noches | Enviado por móvil
MadridPalacioReal,03-10-2023,10,Ana,,Excelente ubicación. Apartamento muy cómodo y confortable. El acceso muy fácil con las instrucciones indicadas. Repetiremos,Viaje de ocio | Familia con niños pequeños | Estudio | Estancia de 4 noches | Enviado por móvil
MadridPalacioReal,01-10-2023,10,Noemi,Tienes que esperar hasta la hora exacta debido a que no suele haber nadie al ser automatico,Era muy amplio y estaba muy céntrico,Viaje de ocio | Pareja | Estudio | Estancia de 2 noches | Enviado por móvil
MadridPalacioReal,30-09-2023,10,Maria,No nos agradó que la limpieza se hiciera cada semana. Aunque sean departamentos es necesario que la limpieza se haga de manera regular y más que estuvimos 12 dias,La ubicación es extraordinaria y el personal de lo más amable,Viaje de ocio | Familia con niños pequeños | Estudio | Estancia de 13 noches | Enviado por móvil
MadridPalacioReal,24-09-2023,"3,0",Rodrigo,"Lo peor el desayuno, horrible las instalaciones para el desayuno, el cuál fue muy pobre. Nada de personal para asistir a los pasajeros, no lo recomendaría a nadie.",La habitación no estaba mal,Viaje de ocio | Pareja | Estudio | Estancia de 1 noche
MadridPalacioReal,21-09-2023,10,Arce,"Lo único que puedo criticar es el colchón del sofá cama... para dos.adultos, es muy finito y por ello incómodo.  Todo lo demás, de 10","Todo impecable, super lindom y la ubicación inmejorable.",Viaje de ocio | Familia con niños pequeños | Estudio Dúplex | Estancia de 2 noches | Enviado por móvil
MadridPalacioReal,19-09-2023,10,Rafael,,"Todo excelente, muy limpio, muy cómodo y la ubicación genial",Viaje de ocio | Pareja | Estudio | Estancia de 2 noches | Enviado por móvil
MadridPalacioReal,14-09-2023,"5,0",Sol,"Se escuchaba tanto a los vecinos del otro apartamento , así como todo el ruido de la gente de la discoteca de enfrente .  También de que trate de comunicarme con el mismo hotel dos veces preguntando sobre una estancia larga y no me hicieron caso.  Además que te envían mensajes para hacer tu check out desde muy temprano a cada momento y no tienes opción de entrar al hotel si no es la hora que la App te indique lo que en la reserva no te lo indica.",Limpieza,Viaje de negocios | Persona que viaja sola | Estudio Deluxe | Estancia de 1 noche | Enviado por móvil
MadridPalacioReal,10-09-2023,"3,0",Josue,"Las fotos parecen otra cosa, el sofa cama es malísimo el colchón , y fuimos varias familias y todos igual… y la limpieza no vienen si quieres algún día que te hagan la cama o cambien sabanas 22 eur extra.",La hubicacion,Viaje de ocio | Familia con niños pequeños | Estudio Deluxe | Estancia de 3 noches | Enviado por móvil
MadridPalacioReal,02-09-2023,"5,0",Víctor,"Había un ruido que parecía venir del techo, seguramente los compresores del aire, que eran muy muy molestos para dormir.",La ubicación es buenísima para poder hacer turismo.,Viaje de ocio | Pareja | Estudio | Estancia de 2 noches | Enviado por móvil
MadridPalacioReal,17-07-2024,"8,0",David,,,Viaje de ocio | Pareja | Estudio | Estancia de 1 noche | Enviado por móvil
MadridPalacioReal,08-07-2024,"9,0",Rosa,,,Viaje de ocio | Grupo | Estudio | Estancia de 2 noches | Enviado por móvil
MadridPalacioReal,08-06-2024,"8,0",Amunategui,,,Viaje de ocio | Pareja | Estudio | Estancia de 1 noche | Enviado por móvil
MadridPalacioReal,07-06-2024,"8,0",Nerea,,,Viaje de ocio | Familia con niños pequeños | Estudio | Estancia de 3 noches | Enviado por móvil
MadridPalacioReal,02-06-2024,"9,0",Alex,,,Viaje de negocios | Grupo | Estudio | Estancia de 1 noche | Enviado por móvil
MadridPalacioReal,27-05-2024,"9,0",Juan,,,Viaje de ocio | Familia con niños pequeños | Estudio Deluxe | Estancia de 2 noches
MadridPalacioReal,20-05-2024,"7,0",Noel,,,Viaje de negocios | Persona que viaja sola | Estudio | Estancia de 1 noche
MadridPalacioReal,23-04-2024,"9,0",Leslie,,,Viaje de ocio | Familia con niños pequeños | Estudio | Estancia de 2 noches | Enviado por móvil
MadridPalacioReal,14-02-2024,"9,0",Emi,,,Viaje de ocio | Persona que viaja sola | Estudio | Estancia de 6 noches
MadridPalacioReal,25-01-2024,"9,0",Johngarvaz,,,Viaje de ocio | Pareja | Estudio Deluxe | Estancia de 1 noche
MadridPalacioReal,20-01-2024,"9,0",Ebs2120,,,Viaje de ocio | Familia con niños pequeños | Estudio Deluxe | Estancia de 5 noches | Enviado por móvil
MadridPalacioReal,18-11-2023,"8,0",Ejaviers,,,Viaje de ocio | Pareja | Estudio | Estancia de 2 noches | Enviado por móvil
MadridPalacioReal,29-10-2023,"9,0",Tomas,,,Viaje de ocio | Pareja | Estudio | Estancia de 2 noches | Enviado por móvil
MadridPalacioReal,22-10-2023,"9,0",Alejandro,,,Viaje de ocio | Pareja | Estudio | Estancia de 1 noche | Enviado por móvil
MadridPalacioReal,15-10-2023,"7,0",Silvia,,,Viaje de ocio | Pareja | Estudio | Estancia de 3 noches | Enviado por móvil
MadridPalacioReal,27-09-2023,"8,0",Francisco,,,Viaje de ocio | Pareja | Estudio | Estancia de 1 noche | Enviado por móvil
MadridPalacioReal,24-09-2023,"9,0",Daniel,,,Viaje de ocio | Pareja | Estudio | Estancia de 3 noches | Enviado por móvil
MadridPalacioReal,23-09-2023,"9,0",Jorge,,,Viaje de ocio | Pareja | Estudio | Estancia de 31 noches
MadridPalacioReal,20-09-2023,"8,0",Eva,,,Familia con niños pequeños | Estudio | Estancia de 1 noche | Enviado por móvil
MadridPalacioReal,21-08-2023,"8,0",Lissette,,,Viaje de ocio | Grupo | Estudio | Estancia de 4 noches
MadridPalacioReal,13-08-2023,"8,0",Francisco,,,Viaje de ocio | Pareja | Estudio | Estancia de 2 noches | Enviado por móvil
MadridPalacioReal,11-08-2023,"8,0",Sergio,,,Viaje de ocio | Grupo | Estudio Deluxe | Estancia de 3 noches
MadridPalacioReal,24-07-2023,"9,0",Tamara,,,Viaje de ocio | Grupo | Estudio Deluxe | Estancia de 1 noche | Enviado por móvil
MadridPalacioReal,12-07-2023,"8,0",Rosa,,,Viaje de ocio | Familia con niños pequeños | Estudio | Estancia de 1 noche | Enviado por móvil
MadridPalacioReal,26-06-2023,"8,0",Francisco,,,Viaje de ocio | Pareja | Estudio | Estancia de 2 noches
MadridPalacioReal,27-06-2023,10,Marcelo,,,Viaje de ocio | Persona que viaja sola | Estudio | Estancia de 1 noche
MadridPalacioReal,20-06-2023,10,Rosmery,,,Viaje de ocio | Pareja | Estudio | Estancia de 1 noche | Enviado por móvil
MadridPalacioReal,19-06-2023,"6,0",Emilio,,,Viaje de ocio | Pareja | Estudio Deluxe | Estancia de 1 noche | Enviado por móvil
MadridPalacioReal,13-06-2023,10,María,,,Viaje de ocio | Pareja | Estudio Dúplex | Estancia de 1 noche | Enviado por móvil
MadridPalacioReal,06-06-2023,10,Carlos,,,Viaje de ocio | Familia con niños pequeños | Estudio | Estancia de 2 noches | Enviado por móvil
MadridPalacioReal,04-06-2023,10,Juan,,,Viaje de ocio | Familia con niños pequeños | Estudio Dúplex | Estancia de 2 noches | Enviado por móvil
MadridPalacioReal,15-05-2023,10,Esteban,,,Viaje de negocios | Pareja | Estudio | Estancia de 1 noche | Enviado por móvil
MadridPalacioReal,13-05-2023,"5,0",Manuel,,,Viaje de ocio | Familia con niños pequeños | Estudio | Estancia de 3 noches | Enviado por móvil
MadridPalacioReal,09-05-2023,10,Torres,,,Viaje de negocios | Persona que viaja sola | Estudio | Estancia de 1 noche | Enviado por móvil
MadridPalacioReal,13-04-2023,10,Orlando,,,Viaje de ocio | Familia con niños pequeños | Estudio Deluxe | Estancia de 1 noche | Enviado por móvil
MadridPalacioReal,13-04-2023,"6,0",Olga,,,Viaje de ocio | Familia con niños pequeños | Estudio Dúplex | Estancia de 1 noche
MadridPalacioReal,03-04-2023,"6,0",Rodrigo,,,Viaje de ocio | Pareja | Estudio | Estancia de 3 noches
MadridPalacioReal,07-03-2023,"4,0",Juzape93,,,Viaje de negocios | Grupo | Apartamento de 1 dormitorio | Estancia de 7 noches
MadridPalacioReal,14-02-2023,10,Rossy,,,Viaje de ocio | Pareja | Estudio | Estancia de 1 noche | Enviado por móvil
MadridPalacioReal,13-02-2023,10,Juan,,,Viaje de ocio | Pareja | Estudio Deluxe | Estancia de 1 noche | Enviado por móvil
MadridPalacioReal,01-02-2023,10,Francesca,,,Pareja | Estudio Deluxe | Estancia de 4 noches | Enviado por móvil
MadridPalacioReal,22-01-2023,10,Alicia,,,Viaje de ocio | Pareja | Estudio Deluxe | Estancia de 1 noche | Enviado por móvil
MadridPalacioReal,18-01-2023,10,Manuel,,,Viaje de ocio | Pareja | Estudio | Estancia de 1 noche | Enviado por móvil
MadridPalacioReal,13-01-2023,10,Diego,,,Viaje de negocios | Persona que viaja sola | Estudio | Estancia de 1 noche
MadridPalacioReal,07-01-2023,"5,0",Correcaminos___,,,Viaje de ocio | Familia con niños pequeños | Estudio Dúplex | Estancia de 2 noches | Enviado por móvil
MadridPalacioReal,25-12-2022,"1,0",Angel,,,Viaje de ocio | Pareja | Estudio | Estancia de 1 noche | Enviado por móvil
MadridPalacioReal,22-08-2025,10,Anónimo,,,Viaje de ocio | Pareja | Estudio Deluxe | Estancia de 1 noche | Enviado por móvil
MadridPalacioReal,08-06-2025,10,Anónimo,,,Viaje de ocio | Pareja | Estudio | Estancia de 1 noche | Enviado por móvil
MalagaTeatroRomano,23-11-2025,"9,0",Ana,El no tener taquillas,"La ubicación excelente..el apartamento todo genial, muy limpio y camas comodas incluido el sofá cama(hemos dormido dos adultos sin problema). La atención por  telefóno tambien excelente y muy agradable y atentos.",Viaje de ocio | Grupo de amigos | Apartamento de 1 dormitorio | Estancia de 1 noche | Enviado por móvil
MalagaTeatroRomano,31-08-2025,"9,0",Idoia,Me gustó mucho pero por sacar una pega me hubiese gustado tener una cafetera Nespresso,"La ubicación excelente pero a pesar de estar en pleno centro es tranquilo y genial para descansar . Las vistas desde la cama espectaculares . Mucha luz , amplio y bonita decoración.",Viaje de ocio | Familia con niños pequeños | Estudio Dúplex | Estancia de 2 noches | Enviado por móvil
MalagaTeatroRomano,31-05-2025,"7,0",Evaristo,"Toda la burocracia informática. Insufrible la entrada. Y me han cargado dos veces el costo. 2X 148,72. Espero que me devuelvan una, aunque no confío nada en su diligencia en devolver. Si en cobrar.",Situación. Limpieza.,Viaje de ocio | Pareja | Apartamento de 1 dormitorio | Estancia de 1 noche | Enviado por móvil
MalagaTeatroRomano,04-05-2025,"8,0",Susana,El sofá era muy incómodo,La ubicación era genial!,Viaje de negocios | Familia con niños pequeños | Apartamento de 1 dormitorio | Estancia de 1 noche | Enviado por móvil
MalagaTeatroRomano,02-05-2025,"7,0",Miguel,"En la zona del dormitorio había un ruido continuo de maquinaria, algo molesto para dormir.","Muy bien ubicado, a pesar de estar en pleno centro no se oía ruido de la calle, era muy espacioso y cuidado el diseño",Viaje de ocio | Grupo | Estudio Dúplex | Estancia de 1 noche | Enviado por móvil
MalagaTeatroRomano,16-03-2025,"9,0",Javier,,"muy buena ubicación todo perfecto, volveré pronto",Viaje de ocio | Familia con niños pequeños | Apartamento de 1 dormitorio | Estancia de 1 noche | Enviado por móvil
MalagaTeatroRomano,26-12-2024,"7,0",Aleksey,"La puerta del baño no se cierra del todo, si viajas con amigos es un poco incomodo ya que se te ve por una raja y no puedes sentrate tranquilo sin saber que nadie te mirará o que no se escuche un pedo :D",Las vistas desde el apartamento,Viaje de ocio | Grupo | Apartamento de 1 dormitorio | Estancia de 1 noche
MalagaTeatroRomano,22-12-2024,"7,0",Vicente,único pero cama ruidosa y gastada,"Ubicación, limpieza, salón con sofá. Inmejorable",Viaje de ocio | Pareja | Apartamento de 1 dormitorio | Estancia de 1 noche
MalagaTeatroRomano,26-11-2024,"9,0",María,horario de entrada tarde te parte el día y la comida,ubicación comodidad,Viaje de ocio | Pareja | Estudio | Estancia de 1 noche | Enviado por móvil
MalagaTeatroRomano,27-10-2024,"8,0",Cristina,por las mañanas hay ruido desde temprano.,"la ubicación y la decoración del apartamento,cama comoda! te dejan una cajita de bienvenida con agua,unas patatas y unos tapones,un detalle.",Viaje de ocio | Pareja | Apartamento de 1 dormitorio | Estancia de 1 noche | Enviado por móvil
MalagaTeatroRomano,08-09-2024,"9,0",Matías,Los ruidos de la calle al ser tan céntrico y los ruidos de uno de los inquilino.,"Muy buen lugar, limpieza y muy moderno",Viaje de ocio | Pareja | Apartamento de 1 dormitorio | Estancia de 2 noches | Enviado por móvil
MalagaTeatroRomano,28-07-2024,"8,0",Belén,Se escuchaba todo lo de fuera,"Ubicación excelente y muy bonito , con regalo de bienvenida y muy atentos con los animales tenía cama y comederos",Viaje de ocio | Pareja | Estudio | Estancia de 2 noches | Enviado por móvil
MalagaTeatroRomano,21-06-2024,"7,0",Paloma,El desayuno. Excesivamente caro para lo que es ...,La ubicación,Viaje de negocios | Persona que viaja sola | Estudio | Estancia de 1 noche | Enviado por móvil
MalagaTeatroRomano,31-05-2024,"9,0",Manuel,,Excelente ubicación. El diseño .,Viaje de ocio | Pareja | Estudio | Estancia de 1 noche | Enviado por móvil
MalagaTeatroRomano,14-04-2024,"7,0",Maria,"La iluminación escasa, pocos productos de baño, sofá incómodo.",La Ubicación.Es muy bonito,Viaje de negocios | Pareja | Apartamento de 1 dormitorio | Estancia de 1 noche | Enviado por móvil
MalagaTeatroRomano,19-03-2024,"7,0",Fidel,"No hay nadie para recibir a los huéspedes, ningún teléfono de contacto, necesito mi factura y no hay un lugar donde reclamarla porque no hay comunicación con los clientes",La ubicación,Viaje de negocios | Persona que viaja sola | Apartamento de 1 dormitorio | Estancia de 4 noches | Enviado por móvil
MalagaTeatroRomano,08-02-2024,"7,0",José,Falta de mobiliario y ruido poco aislamiento acústico entre habitaciones,Emplazamiento y amplitud espacio y tamaño de cama,Viaje de negocios | Persona que viaja sola | Estudio | Estancia de 1 noche | Enviado por móvil
MalagaTeatroRomano,26-01-2024,"8,0",Pilar,Añadiría lamparitas de lectura a cada lado de la cama y tabla de planchar y plancha ;-) Por lo demás el apartamento es estupendo.,"Me ha gustado mucho la estancia, muy agradable, estupenda ubicación y el apartamento precioso. El servicio de atención al público dia telefónica, estupendo.",Viaje de ocio | Pareja | Estudio | Estancia de 1 noche
MalagaTeatroRomano,14-01-2024,"9,0",Hind,Había pedido una cama doble y me dieron dos individuales,Ubicación excelente. Limpio y cómodo.,Viaje de negocios | Familia con niños pequeños | Estudio | Estancia de 1 noche | Enviado por móvil
MalagaTeatroRomano,09-01-2024,"8,0",Francisco,La ducha,Muy bien buena ubicación,Viaje de ocio | Familia con niños pequeños | Apartamento de 1 dormitorio | Estancia de 1 noche | Enviado por móvil
MalagaTeatroRomano,04-01-2024,"7,0",Jesús,"La atención y la falta de personal físico , cuando llegamos al apartamento después de mucho tiempo intentando acceder por internet, la recepción fue de un perro ladrando justo en la puerta de al lado , si hubiese sabido que aceptaban mascotas no hubiese ido",La ubicación,Viaje de ocio | Familia con niños pequeños | Apartamento de 1 dormitorio | Estancia de 1 noche | Enviado por móvil
MalagaTeatroRomano,02-01-2024,"8,0",Carmen,Todo fue correcto,La ubicación,Viaje de ocio | Familia con niños pequeños | Apartamento de 1 dormitorio | Estancia de 1 noche | Enviado por móvil
MalagaTeatroRomano,10-12-2023,"8,0",Norma,Muy caro y la limpieza mejorable (habia comida de huespedes anteriores en la nevera). Es incomodo que el baño este en la planta de abajo y el dormitorio arriba. Fue muy caro,Ubicación inmejorable,Viaje de ocio | Familia con niños pequeños | Estudio Dúplex | Estancia de 2 noches | Enviado por móvil
MalagaTeatroRomano,10-12-2023,"9,0",Francisco,"Solicité cama doble por ocasión especial, pero no se me facilitó. La hora de salida a las 11 de la mañana la retrasaría un poco. Medio te obligan a contratar el late check out.","La ubicación, la amplitud y la limpieza de la habitación; es tal cual aparece en las fotos o incluso mejor. También el hecho de poder acceder con libertad sin necesidad de lidiar con personal.",Viaje de ocio | Familia con niños pequeños | Estudio | Estancia de 1 noche | Enviado por móvil
MalagaTeatroRomano,29-07-2023,"5,0",Lola,"La televisión del apartamento no se corresponde con la que figura en las fotos, era una televisión pequeñita.
Una de las noches saltó la alarma y estuvo soñando ininterrumpidamente durante una hora.","Edificio bonito, muy céntrico, limpio y bien conservado",Viaje de ocio | Pareja | Estudio | Estancia de 4 noches | Enviado por móvil
MalagaTeatroRomano,22-07-2023,"6,0",Ana,Control de los huéspedes. Tuvimos una piara de guiris poniendo música y metiendo gritos en el rellano desde las 5 de la mañana hasta las 8.,"La ubicación excepcional. Centro de Málaga, cerca de todo tipo de comercios y restaurantes",Viaje de ocio | Familia con niños pequeños | Apartamento de 1 dormitorio | Estancia de 1 noche | Enviado por móvil
MalagaTeatroRomano,19-07-2023,10,Antonio,Un balcón o terraza,La ubicación,Viaje de ocio | Familia con niños pequeños | Apartamento de 1 dormitorio | Estancia de 3 noches | Enviado por móvil
MalagaTeatroRomano,17-07-2023,10,Pedro,Algo de ruido x la noche en la calle,Situación,Viaje de ocio | Familia con niños pequeños | Estudio | Estancia de 1 noche | Enviado por móvil
MalagaTeatroRomano,16-07-2023,10,Belen,,Ubicación perfecta en pleno centro de Málaga y todo muy nuevo con decoración bonita y además muy limpio. Nos encantó. Fácil check in con llave digital en tu móvil.,Viaje de ocio | Pareja | Estudio | Estancia de 1 noche | Enviado por móvil
MalagaTeatroRomano,14-07-2023,10,Maria,Me gustó todo,Situación y limpieza,Viaje de ocio | Familia con niños pequeños | Estudio | Estancia de 4 noches | Enviado por móvil
MalagaTeatroRomano,09-05-2023,"6,0",Monica,"sobre todo las ventanas de los miradores,  dos de ellas no cerraban bien y se oia todo el ruido   sobre todo el nocturno por estar en centro de ocio de bares y restaurantes (muy dificil dormir ) tampoco tenia contraventanas un mirador por lo que entraba   la luz. Lo demás está bien salvo el armario muy pequeño y solo con barra ,",la ubicación es buena ya que está en centro turistico de Málaga.,Viaje de ocio | Pareja | Estudio | Estancia de 4 noches
MalagaTeatroRomano,22-04-2023,10,Natalia,,Todo,Familia con niños pequeños | Apartamento de 1 dormitorio | Estancia de 1 noche | Enviado por móvil
MalagaTeatroRomano,09-04-2023,10,Julio,Nada,La amabilidad del personal,Viaje de ocio | Grupo de amigos | Estudio | Estancia de 1 noche | Enviado por móvil
